{
  "schema_version": "1.0",
  "diagram_id": "D-causal-chain",
  "diagram_type": "causal_chain",
  "audience_question": "Why does better validation improve delivery?",
  "message": "Earlier checks reduce late rework and increase reliable handoff.",
  "direction": "left_to_right",
  "nodes": [
    {"id": "N1", "label": "Early Check", "role": "cause", "node_type": "control", "priority": "primary", "sequence": 1, "shape": "rounded_rect", "status": "normal"},
    {"id": "N2", "label": "Less Rework", "role": "mechanism", "node_type": "outcome", "priority": "primary", "sequence": 2, "shape": "rounded_rect", "status": "normal"},
    {"id": "N3", "label": "Reliable Handoff", "role": "effect", "node_type": "outcome", "priority": "primary", "sequence": 3, "shape": "rounded_rect", "status": "highlighted"},
    {"id": "N4", "label": "Cost", "role": "metric", "node_type": "data", "priority": "supporting", "sequence": 4, "shape": "database", "status": "normal"}
  ],
  "groups": [],
  "edges": [
    {"id": "E1", "source": "N1", "target": "N2", "relation": "influence", "priority": "primary", "direction": "forward", "style": "curved"},
    {"id": "E2", "source": "N2", "target": "N3", "relation": "produce", "priority": "primary", "direction": "forward", "style": "orthogonal"},
    {"id": "E3", "source": "N4", "target": "N2", "relation": "monitoring", "priority": "supporting", "direction": "forward", "style": "dashed", "line_semantics": "dashed"}
  ],
  "main_paths": [{"id": "P1", "label": "Causal path", "node_ids": ["N1", "N2", "N3"], "priority": "primary"}],
  "boundaries": [],
  "layout_constraints": {"preferred_layout": "process", "allow_layout_change": true, "max_primary_nodes": 8, "max_total_nodes": 14, "max_primary_edges": 9, "max_total_edges": 18},
  "delivery_contract": {"preferred_route": "native_diagram", "allowed_fallbacks": ["hybrid_overlay", "svg_component"], "editable_core": ["nodes", "labels"], "raster_policy": {"allowed": false, "max_area_ratio": 0, "whole_slide_forbidden": true, "requires_disclosure": true, "requires_native_overlay": true}},
  "metadata": {}
}
