{
  "schema_version": "1.0",
  "diagram_id": "D-data-flow",
  "diagram_type": "data_flow",
  "audience_question": "Where does data move?",
  "message": "Source data is transformed, checked, and delivered to the deck builder.",
  "direction": "left_to_right",
  "nodes": [
    {"id": "N1", "label": "Source", "role": "input", "node_type": "data", "priority": "primary", "sequence": 1, "shape": "database", "status": "normal"},
    {"id": "N2", "label": "Transform", "role": "process", "node_type": "service", "priority": "primary", "sequence": 2, "shape": "rounded_rect", "status": "normal"},
    {"id": "N3", "label": "Validate", "role": "qa", "node_type": "control", "priority": "primary", "sequence": 3, "shape": "rounded_rect", "status": "highlighted"},
    {"id": "N4", "label": "Builder", "role": "consumer", "node_type": "service", "priority": "secondary", "sequence": 4, "shape": "cloud", "status": "normal"}
  ],
  "groups": [],
  "edges": [
    {"id": "E1", "source": "N1", "target": "N2", "relation": "data_flow", "priority": "primary", "direction": "forward", "style": "orthogonal"},
    {"id": "E2", "source": "N2", "target": "N3", "relation": "validation", "priority": "primary", "direction": "forward", "style": "orthogonal"},
    {"id": "E3", "source": "N3", "target": "N4", "relation": "produce", "priority": "secondary", "direction": "forward", "style": "orthogonal"}
  ],
  "main_paths": [{"id": "P1", "label": "Data path", "node_ids": ["N1", "N2", "N3"], "priority": "primary"}],
  "boundaries": [],
  "layout_constraints": {"preferred_layout": "process", "allow_layout_change": true, "max_primary_nodes": 8, "max_total_nodes": 14, "max_primary_edges": 9, "max_total_edges": 18},
  "delivery_contract": {"preferred_route": "native_diagram", "allowed_fallbacks": ["hybrid_overlay", "svg_component"], "editable_core": ["system_labels", "data_labels"], "raster_policy": {"allowed": false, "max_area_ratio": 0, "whole_slide_forbidden": true, "requires_disclosure": true, "requires_native_overlay": true}},
  "metadata": {}
}
