{
  "schema_version": "1.0",
  "diagram_id": "D-capability-landscape",
  "diagram_type": "capability_landscape",
  "audience_question": "Which capabilities does the system cover?",
  "message": "The platform covers planning, creation, verification, and publishing capabilities.",
  "direction": "free",
  "nodes": [
    {"id": "N1", "label": "Plan", "role": "capability", "node_type": "capability", "group_id": "G1", "priority": "primary", "sequence": 1, "shape": "rounded_rect", "status": "normal"},
    {"id": "N2", "label": "Create", "role": "capability", "node_type": "capability", "group_id": "G1", "priority": "primary", "sequence": 2, "shape": "rounded_rect", "status": "normal"},
    {"id": "N3", "label": "Verify", "role": "capability", "node_type": "control", "group_id": "G2", "priority": "primary", "sequence": 3, "shape": "rounded_rect", "status": "highlighted"},
    {"id": "N4", "label": "Publish", "role": "capability", "node_type": "service", "group_id": "G2", "priority": "secondary", "sequence": 4, "shape": "rounded_rect", "status": "normal"}
  ],
  "groups": [
    {"id": "G1", "label": "Creation", "group_type": "capability_cluster", "node_ids": ["N1", "N2"], "priority": "primary", "visual_role": "region", "layout": "grid"},
    {"id": "G2", "label": "Delivery", "group_type": "capability_cluster", "node_ids": ["N3", "N4"], "priority": "primary", "visual_role": "region", "layout": "grid"}
  ],
  "edges": [
    {"id": "E1", "source": "N1", "target": "N2", "relation": "sequence", "priority": "primary", "direction": "forward", "style": "orthogonal"},
    {"id": "E2", "source": "N2", "target": "N3", "relation": "validation", "priority": "primary", "direction": "forward", "style": "orthogonal", "cross_boundary": true},
    {"id": "E3", "source": "N3", "target": "N4", "relation": "produce", "priority": "secondary", "direction": "forward", "style": "orthogonal"}
  ],
  "main_paths": [{"id": "P1", "label": "Capability path", "node_ids": ["N1", "N2", "N3"], "priority": "primary"}],
  "boundaries": [],
  "layout_constraints": {"preferred_layout": "capability_landscape", "allow_layout_change": true, "max_primary_nodes": 8, "max_total_nodes": 14, "max_primary_edges": 9, "max_total_edges": 18},
  "delivery_contract": {"preferred_route": "native_diagram", "allowed_fallbacks": ["hybrid_overlay", "svg_component"], "editable_core": ["region_labels", "node_labels"], "raster_policy": {"allowed": false, "max_area_ratio": 0, "whole_slide_forbidden": true, "requires_disclosure": true, "requires_native_overlay": true}},
  "metadata": {}
}
