{
  "schema_version": "1.0",
  "diagram_id": "D-decision-tree",
  "diagram_type": "decision_tree",
  "audience_question": "How should a route be selected?",
  "message": "Native-required objects either use a native route or become unsupported.",
  "direction": "left_to_right",
  "nodes": [
    {"id": "N1", "label": "Need Native?", "role": "decision", "node_type": "decision", "priority": "primary", "sequence": 1, "shape": "diamond", "status": "normal"},
    {"id": "N2", "label": "Native Route", "role": "yes", "node_type": "outcome", "priority": "primary", "sequence": 2, "shape": "rounded_rect", "status": "highlighted"},
    {"id": "N3", "label": "Fallback", "role": "no", "node_type": "outcome", "priority": "secondary", "sequence": 3, "shape": "rounded_rect", "status": "normal"},
    {"id": "N4", "label": "Unsupported", "role": "blocked", "node_type": "risk", "priority": "secondary", "sequence": 4, "shape": "rounded_rect", "status": "warning"}
  ],
  "groups": [],
  "edges": [
    {"id": "E1", "source": "N1", "target": "N2", "relation": "approval", "label": "yes", "priority": "primary", "direction": "forward", "style": "orthogonal"},
    {"id": "E2", "source": "N2", "target": "N4", "relation": "validation", "priority": "primary", "direction": "forward", "style": "orthogonal"},
    {"id": "E3", "source": "N1", "target": "N3", "relation": "fallback", "label": "no", "priority": "secondary", "direction": "forward", "style": "curved", "line_semantics": "dashed"}
  ],
  "main_paths": [{"id": "P1", "label": "Native path", "node_ids": ["N1", "N2", "N4"], "priority": "primary"}],
  "boundaries": [],
  "layout_constraints": {"preferred_layout": "tree", "allow_layout_change": true, "max_primary_nodes": 8, "max_total_nodes": 14, "max_primary_edges": 9, "max_total_edges": 18},
  "delivery_contract": {"preferred_route": "native_diagram", "allowed_fallbacks": ["hybrid_overlay", "svg_component"], "editable_core": ["decision", "labels"], "raster_policy": {"allowed": false, "max_area_ratio": 0, "whole_slide_forbidden": true, "requires_disclosure": true, "requires_native_overlay": true}},
  "metadata": {}
}
