{
  "schema_version": "1.0",
  "diagram_id": "D-issue-tree",
  "diagram_type": "issue_tree",
  "audience_question": "What explains the delivery risk?",
  "message": "Delivery risk decomposes into scope, capability, and verification gaps.",
  "direction": "left_to_right",
  "nodes": [
    {"id": "N1", "label": "Delivery Risk", "role": "root", "node_type": "risk", "priority": "primary", "sequence": 1, "shape": "rounded_rect", "status": "warning"},
    {"id": "N2", "label": "Scope", "role": "branch", "node_type": "capability", "priority": "primary", "sequence": 2, "shape": "rounded_rect", "status": "normal"},
    {"id": "N3", "label": "Capability", "role": "branch", "node_type": "capability", "priority": "primary", "sequence": 3, "shape": "rounded_rect", "status": "normal"},
    {"id": "N4", "label": "Verification", "role": "branch", "node_type": "control", "priority": "secondary", "sequence": 4, "shape": "rounded_rect", "status": "normal"}
  ],
  "groups": [],
  "edges": [
    {"id": "E1", "source": "N1", "target": "N2", "relation": "contain", "priority": "primary", "direction": "forward", "style": "orthogonal"},
    {"id": "E2", "source": "N2", "target": "N3", "relation": "sequence", "priority": "primary", "direction": "forward", "style": "orthogonal"},
    {"id": "E3", "source": "N3", "target": "N4", "relation": "validation", "priority": "secondary", "direction": "forward", "style": "dashed", "line_semantics": "dashed"}
  ],
  "main_paths": [{"id": "P1", "label": "Issue spine", "node_ids": ["N1", "N2", "N3"], "priority": "primary"}],
  "boundaries": [],
  "layout_constraints": {"preferred_layout": "tree", "allow_layout_change": true, "max_primary_nodes": 8, "max_total_nodes": 14, "max_primary_edges": 9, "max_total_edges": 18},
  "delivery_contract": {"preferred_route": "native_diagram", "allowed_fallbacks": ["hybrid_overlay", "svg_component"], "editable_core": ["nodes", "labels"], "raster_policy": {"allowed": false, "max_area_ratio": 0, "whole_slide_forbidden": true, "requires_disclosure": true, "requires_native_overlay": true}},
  "metadata": {}
}
