{
  "schema_version": "1.0",
  "diagram_id": "D-process-simple",
  "title": "Simple Process",
  "diagram_type": "process_flow",
  "audience_question": "How does the work move from request to verification?",
  "message": "The core path moves from intake to build to verification.",
  "direction": "left_to_right",
  "reading_order": "main_path_then_supporting",
  "nodes": [
    {"id": "N1", "label": "Intake", "role": "entry", "node_type": "event", "priority": "primary", "sequence": 1, "shape": "rounded_rect", "status": "normal"},
    {"id": "N2", "label": "Build", "role": "work", "node_type": "capability", "priority": "primary", "sequence": 2, "shape": "rounded_rect", "status": "normal"},
    {"id": "N3", "label": "Verify", "role": "quality", "node_type": "control", "priority": "primary", "sequence": 3, "shape": "rounded_rect", "status": "normal"},
    {"id": "N4", "label": "Notes", "role": "support", "node_type": "artifact", "priority": "supporting", "sequence": 4, "shape": "document", "status": "normal"}
  ],
  "groups": [],
  "edges": [
    {"id": "E1", "source": "N1", "target": "N2", "relation": "sequence", "priority": "primary", "direction": "forward", "style": "orthogonal", "line_semantics": "solid"},
    {"id": "E2", "source": "N2", "target": "N3", "relation": "validation", "priority": "primary", "direction": "forward", "style": "orthogonal", "line_semantics": "solid"},
    {"id": "E3", "source": "N4", "target": "N2", "relation": "consume", "priority": "supporting", "direction": "forward", "style": "dashed", "line_semantics": "dashed", "optional": true}
  ],
  "main_paths": [{"id": "P1", "label": "Main path", "node_ids": ["N1", "N2", "N3"], "edge_ids": ["E1", "E2"], "priority": "primary"}],
  "boundaries": [],
  "annotations": [{"id": "A1", "annotation_type": "note", "target_type": "node", "target_id": "N4", "label": "Supporting evidence", "priority": "low", "editable": true}],
  "layout_constraints": {"preferred_layout": "process", "allow_layout_change": true, "max_primary_nodes": 8, "max_total_nodes": 14, "max_primary_edges": 9, "max_total_edges": 18},
  "delivery_contract": {"preferred_route": "native_diagram", "allowed_fallbacks": ["hybrid_overlay", "svg_component"], "editable_core": ["nodes", "labels"], "raster_policy": {"allowed": false, "max_area_ratio": 0, "whole_slide_forbidden": true, "requires_disclosure": true, "requires_native_overlay": true}},
  "qa_expectations": ["DIAGRAM_MAIN_PATH"],
  "metadata": {}
}
